Indicador,Area,Keyword,Unidad,Meta 2025,Acumulado,% Acumulado,Logro 2023,Logro 2024
Tasa de desempleo en la región,Contexto socioeconómico,Desempleo,Porcentaje,10,11.5,0,12,11.8
PIB per cápita regional,Contexto socioeconómico,PIB,Pesos,25000000,0,0,22000000,23500000
Índice de pobreza multidimensional,Contexto socioeconómico,IPM,Porcentaje,15,18,0,20,19
Cobertura de servicios públicos,Contexto socioeconómico,Servicios,Porcentaje,95,90,0,85,88
Tasa de alfabetización,Contexto socioeconómico,Alfabetización,Porcentaje,97,0,0,95,96